{
  "$schema": "https://json-schema.org/draft/2020-12/schema",
  "$id": "https://dash-brain.local/schemas/workflow.json",
  "title": "Core Workflow Definition",
  "description": "Defines a multi-step agent workflow with dependencies, conditional logic, and error recovery.",
  "type": "object",
  "required": ["name", "version", "steps"],
  "additionalProperties": false,
  "properties": {
    "name": {
      "type": "string",
      "description": "Human-readable workflow name.",
      "minLength": 1,
      "maxLength": 120
    },
    "version": {
      "type": "string",
      "description": "Semantic version of this workflow definition.",
      "pattern": "^\\d+\\.\\d+\\.\\d+$"
    },
    "description": {
      "type": "string",
      "description": "What this workflow does and when to use it."
    },
    "tags": {
      "type": "array",
      "items": { "type": "string" },
      "description": "Tags for discovery and skill matching."
    },
    "inputs": {
      "type": "object",
      "description": "Workflow-level input parameters. Keys are parameter names.",
      "additionalProperties": {
        "$ref": "#/$defs/parameterDef"
      }
    },
    "outputs": {
      "type": "object",
      "description": "Workflow-level outputs mapped from step results.",
      "additionalProperties": {
        "type": "object",
        "required": ["fromStep", "value"],
        "additionalProperties": false,
        "properties": {
          "fromStep": {
            "type": "string",
            "description": "Step key to source the value from."
          },
          "value": {
            "type": "string",
            "description": "Expression referencing the step output (e.g. 'output', 'status')."
          }
        }
      }
    },
    "mode": {
      "type": "string",
      "enum": ["sequential", "parallel", "dependency"],
      "default": "dependency",
      "description": "Default execution mode. 'dependency' respects dependsOn edges; 'sequential' runs steps in definition order; 'parallel' runs all at once."
    },
    "maxConcurrent": {
      "type": "integer",
      "minimum": 1,
      "default": 5,
      "description": "Max concurrent agents when mode is 'parallel' or 'dependency'."
    },
    "timeoutMs": {
      "type": "integer",
      "minimum": 1000,
      "description": "Wall-clock timeout for the entire workflow."
    },
    "onFailure": {
      "$ref": "#/$defs/failurePolicy",
      "description": "Default failure policy applied to steps that don't define their own."
    },
    "steps": {
      "type": "array",
      "minItems": 1,
      "items": { "$ref": "#/$defs/step" },
      "description": "Ordered list of workflow steps."
    }
  },
  "$defs": {
    "parameterDef": {
      "type": "object",
      "required": ["type"],
      "additionalProperties": false,
      "properties": {
        "type": {
          "type": "string",
          "enum": ["string", "number", "boolean"],
          "description": "Parameter data type."
        },
        "description": {
          "type": "string"
        },
        "required": {
          "type": "boolean",
          "default": false
        },
        "default": {
          "description": "Default value if not provided at runtime."
        }
      }
    },
    "step": {
      "type": "object",
      "required": ["key", "label", "prompt"],
      "additionalProperties": false,
      "properties": {
        "key": {
          "type": "string",
          "pattern": "^[a-z][a-z0-9_-]*$",
          "description": "Unique identifier within the workflow. Lowercase, alphanumeric with hyphens/underscores."
        },
        "label": {
          "type": "string",
          "description": "Human-readable step name."
        },
        "prompt": {
          "type": "string",
          "description": "Agent prompt. Supports {{input.paramName}} and {{steps.prevKey.output}} template interpolation."
        },
        "dependsOn": {
          "type": "array",
          "items": { "type": "string" },
          "description": "Step keys that must complete before this step runs."
        },
        "condition": {
          "$ref": "#/$defs/condition",
          "description": "Conditional gate — step only runs if this evaluates to true."
        },
        "inputs": {
          "type": "object",
          "description": "Input mappings from workflow inputs or prior step outputs.",
          "additionalProperties": {
            "type": "string"
          }
        },
        "priority": {
          "type": "integer",
          "minimum": 0,
          "maximum": 100,
          "default": 50,
          "description": "Priority (0 = highest). Used for scheduling order."
        },
        "timeoutMs": {
          "type": "integer",
          "minimum": 1000,
          "description": "Per-step timeout override."
        },
        "retries": {
          "type": "integer",
          "minimum": 0,
          "maximum": 5,
          "default": 0,
          "description": "Number of retry attempts on failure."
        },
        "onFailure": {
          "$ref": "#/$defs/failurePolicy",
          "description": "Step-level failure policy, overrides workflow default."
        },
        "tags": {
          "type": "array",
          "items": { "type": "string" }
        },
        "cwd": {
          "type": "string",
          "description": "Working directory override for this step's agent."
        }
      }
    },
    "condition": {
      "type": "object",
      "description": "Conditional expression. Exactly one of the operator fields must be set.",
      "additionalProperties": false,
      "properties": {
        "stepStatus": {
          "type": "object",
          "required": ["step", "equals"],
          "additionalProperties": false,
          "properties": {
            "step": { "type": "string", "description": "Step key to check." },
            "equals": {
              "type": "string",
              "enum": ["completed", "failed", "skipped"],
              "description": "Required status."
            }
          },
          "description": "True if the referenced step finished with the given status."
        },
        "inputEquals": {
          "type": "object",
          "required": ["input", "value"],
          "additionalProperties": false,
          "properties": {
            "input": { "type": "string", "description": "Workflow input parameter name." },
            "value": { "description": "Expected value." }
          },
          "description": "True if a workflow input matches the given value."
        },
        "allOf": {
          "type": "array",
          "items": { "$ref": "#/$defs/condition" },
          "description": "All sub-conditions must be true (logical AND)."
        },
        "anyOf": {
          "type": "array",
          "items": { "$ref": "#/$defs/condition" },
          "description": "At least one sub-condition must be true (logical OR)."
        },
        "not": {
          "$ref": "#/$defs/condition",
          "description": "Negation of a sub-condition."
        }
      }
    },
    "failurePolicy": {
      "type": "object",
      "required": ["action"],
      "additionalProperties": false,
      "properties": {
        "action": {
          "type": "string",
          "enum": ["stop", "continue", "fallback"],
          "description": "'stop' aborts the workflow. 'continue' skips the failed step and proceeds. 'fallback' runs the fallbackStep."
        },
        "fallbackStep": {
          "type": "string",
          "description": "Step key to run as a fallback (required when action is 'fallback')."
        }
      }
    }
  }
}
