{
  "name": "research-and-write",
  "version": "1.0.0",
  "description": "Research a topic, draft content based on findings, then review for quality. Demonstrates sequential dependency chains, template interpolation, and error recovery with fallback.",
  "tags": ["content", "research", "writing"],
  "inputs": {
    "topic": {
      "type": "string",
      "description": "The topic to research and write about.",
      "required": true
    },
    "format": {
      "type": "string",
      "description": "Output format: 'blog', 'memo', or 'summary'.",
      "default": "blog"
    }
  },
  "outputs": {
    "draft": {
      "fromStep": "write",
      "value": "output"
    },
    "review": {
      "fromStep": "review",
      "value": "output"
    }
  },
  "mode": "dependency",
  "maxConcurrent": 2,
  "onFailure": {
    "action": "continue"
  },
  "steps": [
    {
      "key": "research",
      "label": "Research topic",
      "prompt": "Research the following topic thoroughly: {{input.topic}}\n\nGather key facts, recent developments, and relevant context. Output a structured research brief with sections: Overview, Key Points, Sources, and Open Questions.",
      "tags": ["research"],
      "retries": 1,
      "timeoutMs": 300000,
      "onFailure": {
        "action": "fallback",
        "fallbackStep": "research-lite"
      }
    },
    {
      "key": "research-lite",
      "label": "Lightweight research fallback",
      "prompt": "Provide a brief overview of: {{input.topic}}\n\nFocus on the most essential facts and context. Keep it concise — this is a fallback for when deep research fails.",
      "tags": ["research", "fallback"],
      "timeoutMs": 120000
    },
    {
      "key": "write",
      "label": "Draft content",
      "prompt": "Using the following research:\n\n{{steps.research.output}}\n\nWrite a {{input.format}} about \"{{input.topic}}\". Follow the appropriate style and structure for the format. Make it engaging and well-organized.",
      "dependsOn": ["research"],
      "tags": ["writing"],
      "retries": 1,
      "timeoutMs": 300000
    },
    {
      "key": "review",
      "label": "Review and polish",
      "prompt": "Review the following draft for accuracy, clarity, tone, and structure:\n\n{{steps.write.output}}\n\nProvide specific feedback and a revised version. Check facts against the research brief:\n\n{{steps.research.output}}",
      "dependsOn": ["write"],
      "tags": ["review", "editing"],
      "timeoutMs": 180000
    }
  ]
}
